{
  "$schema": "https://json-schema.org/draft/2020-12/schema",
  "$id": "https://speckit-companion/spec-context.schema.json",
  "title": "SpecContext",
  "type": "object",
  "additionalProperties": true,
  "required": ["workflow", "specName", "branch", "currentStep", "status", "history"],
  "properties": {
    "workflow": { "type": "string", "minLength": 1 },
    "specName": { "type": "string", "minLength": 1 },
    "branch": { "type": "string", "minLength": 1 },
    "selectedAt": { "type": "string", "format": "date-time" },
    "currentStep": {
      "type": "string",
      "enum": ["specify", "clarify", "plan", "tasks", "analyze", "implement", "checklist", "git.validate"]
    },
    "status": {
      "type": "string",
      "enum": [
        "draft", "specifying", "specified",
        "planning", "planned",
        "tasking", "ready-to-implement",
        "implementing", "implemented",
        "finalizing", "finalized",
        "completed", "archived"
      ]
    },
    "history": {
      "type": "array",
      "items": { "$ref": "#/$defs/historyEntry" }
    },
    "reviewComments": {
      "type": "array",
      "items": { "$ref": "#/$defs/reviewComment" }
    },
    "last_action": { "type": "string" },
    "task_summaries": { "type": "object" },
    "step_summaries": { "type": "object" }
  },
  "$defs": {
    "reviewComment": {
      "type": "object",
      "required": ["id", "doc", "anchor", "comment", "status", "createdAt"],
      "properties": {
        "id": { "type": "string", "minLength": 1 },
        "doc": { "type": "string", "enum": ["spec", "plan", "tasks"] },
        "anchor": {
          "type": "object",
          "required": ["heading", "blockText", "line"],
          "properties": {
            "heading": { "type": ["string", "null"] },
            "blockText": { "type": "string" },
            "line": { "type": "integer", "minimum": 0 }
          }
        },
        "comment": { "type": "string" },
        "status": { "type": "string", "enum": ["pending", "applied"] },
        "createdAt": { "type": "string", "format": "date-time" }
      }
    },
    "historyEntry": {
      "type": "object",
      "required": ["step", "substep", "kind", "by", "at"],
      "properties": {
        "step": {
          "type": "string",
          "enum": ["specify", "clarify", "plan", "tasks", "analyze", "implement", "checklist", "git.validate"]
        },
        "substep": { "type": ["string", "null"] },
        "kind": { "type": "string", "enum": ["start", "complete"] },
        "from": {
          "type": "object",
          "required": ["step", "substep"],
          "properties": {
            "step": {
              "type": ["string", "null"],
              "enum": ["specify", "clarify", "plan", "tasks", "analyze", "implement", "checklist", "git.validate", null]
            },
            "substep": { "type": ["string", "null"] }
          }
        },
        "by": { "type": "string", "enum": ["extension", "user", "cli", "sdd", "sdd-skill", "ai"] },
        "at": { "type": "string", "format": "date-time" }
      }
    }
  }
}
