{
  "workflow": "speckit",
  "specName": "Demo — Tasked",
  "branch": "demo/tasked",
  "selectedAt": "2026-05-20T20:00:00.000Z",
  "currentStep": "tasks",
  "status": "archived",
  "history": [
    {
      "step": "tasks",
      "substep": null,
      "kind": "complete",
      "by": "extension",
      "at": "2026-06-01T15:27:08.985Z"
    }
  ]
}