{
  "workflow": "speckit",
  "specName": "Footer Action Consolidation",
  "branch": "123-footer-action-consolidation",
  "selectedAt": "2026-06-08T15:22:17.741Z",
  "currentStep": "git.validate",
  "status": "finalized",
  "history": [
    {
      "step": "specify",
      "substep": null,
      "kind": "start",
      "from": {
        "step": null,
        "substep": null
      },
      "by": "extension",
      "at": "2026-06-08T15:22:17.741Z"
    },
    {
      "step": "specify",
      "substep": null,
      "kind": "complete",
      "by": "ai",
      "at": "2026-06-08T15:22:59Z"
    },
    {
      "step": "clarify",
      "substep": null,
      "kind": "start",
      "from": {
        "step": "specify",
        "substep": null
      },
      "by": "extension",
      "at": "2026-06-08T15:27:41.429Z"
    },
    {
      "step": "clarify",
      "substep": null,
      "kind": "complete",
      "by": "extension",
      "at": "2026-06-08T15:28:51.208Z"
    },
    {
      "step": "plan",
      "substep": null,
      "kind": "start",
      "from": {
        "step": "clarify",
        "substep": null
      },
      "by": "extension",
      "at": "2026-06-08T15:29:18.083Z"
    },
    {
      "step": "plan",
      "substep": null,
      "kind": "complete",
      "by": "ai",
      "at": "2026-06-08T15:31:36Z"
    },
    {
      "step": "checklist",
      "substep": null,
      "kind": "start",
      "from": {
        "step": "plan",
        "substep": null
      },
      "by": "extension",
      "at": "2026-06-08T15:35:56.811Z"
    },
    {
      "step": "checklist",
      "substep": null,
      "kind": "complete",
      "by": "ai",
      "at": "2026-06-08T15:36:53Z"
    },
    {
      "step": "tasks",
      "substep": null,
      "kind": "start",
      "from": {
        "step": "checklist",
        "substep": null
      },
      "by": "extension",
      "at": "2026-06-08T15:39:07.987Z"
    },
    {
      "step": "tasks",
      "substep": null,
      "kind": "complete",
      "by": "ai",
      "at": "2026-06-08T15:40:29Z"
    },
    {
      "step": "analyze",
      "substep": null,
      "kind": "start",
      "from": {
        "step": "tasks",
        "substep": null
      },
      "by": "extension",
      "at": "2026-06-08T15:41:40.335Z"
    },
    {
      "step": "analyze",
      "substep": null,
      "kind": "complete",
      "by": "ai",
      "at": "2026-06-08T15:46:33Z"
    },
    {
      "step": "implement",
      "substep": null,
      "kind": "start",
      "from": {
        "step": "analyze",
        "substep": null
      },
      "by": "extension",
      "at": "2026-06-08T15:47:06.719Z"
    },
    {
      "step": "implement",
      "substep": null,
      "kind": "complete",
      "by": "ai",
      "at": "2026-06-08T15:49:56Z"
    },
    {
      "step": "git.validate",
      "substep": null,
      "kind": "start",
      "from": {
        "step": "implement",
        "substep": null
      },
      "by": "extension",
      "at": "2026-06-08T15:50:53.477Z"
    },
    {
      "step": "git.validate",
      "substep": null,
      "kind": "complete",
      "by": "extension",
      "at": "2026-06-08T15:53:20.914Z"
    }
  ]
}