{
  "workflow": "speckit",
  "specName": "Demo — Specified",
  "branch": "demo/specified",
  "selectedAt": "2026-05-20T20:00:00.000Z",
  "currentStep": "specify",
  "status": "archived",
  "history": [
    {
      "step": "specify",
      "substep": null,
      "kind": "complete",
      "by": "extension",
      "at": "2026-06-01T15:27:04.612Z"
    }
  ]
}