{
  "workflow": "speckit",
  "specName": "Demo — Planned",
  "branch": "demo/planned",
  "selectedAt": "2026-05-20T20:00:00.000Z",
  "currentStep": "plan",
  "status": "archived",
  "history": [
    {
      "step": "plan",
      "substep": null,
      "kind": "complete",
      "by": "extension",
      "at": "2026-06-01T15:27:06.882Z"
    }
  ]
}